[
  {
    "schemaVersion": 1,
    "id": "color.background",
    "label": "背景",
    "category": "color",
    "defaultValue": "#f7f8fa",
    "description": "页面背景色"
  },
  {
    "schemaVersion": 1,
    "id": "color.surface",
    "label": "表面",
    "category": "color",
    "defaultValue": "#ffffff",
    "description": "卡片与面板表面色"
  },
  {
    "schemaVersion": 1,
    "id": "color.primary",
    "label": "主色",
    "category": "color",
    "defaultValue": "#2f73d2",
    "description": "克制强调色，仅用于选择、焦点、链接与进度"
  },
  {
    "schemaVersion": 1,
    "id": "color.primary-soft",
    "label": "主色软底",
    "category": "color",
    "defaultValue": "#eaf2fd",
    "description": "主色混合实色软底（非 alpha），用于 Chip / tonal"
  },
  {
    "schemaVersion": 1,
    "id": "color.on-primary",
    "label": "主色上文字",
    "category": "color",
    "defaultValue": "#ffffff"
  },
  {
    "schemaVersion": 1,
    "id": "color.action",
    "label": "主操作",
    "category": "color",
    "defaultValue": "#202124",
    "description": "实心主按钮使用的中性色，不复用强调色"
  },
  {
    "schemaVersion": 1,
    "id": "color.action-soft",
    "label": "主操作软底",
    "category": "color",
    "defaultValue": "#e8e9ea",
    "description": "主操作混合实色软底，用于 tonal 按钮"
  },
  {
    "schemaVersion": 1,
    "id": "color.on-action",
    "label": "主操作上文字",
    "category": "color",
    "defaultValue": "#ffffff"
  },
  {
    "schemaVersion": 1,
    "id": "color.secondary",
    "label": "次色",
    "category": "color",
    "defaultValue": "#66707a"
  },
  {
    "schemaVersion": 1,
    "id": "color.secondary-soft",
    "label": "次色软底",
    "category": "color",
    "defaultValue": "#f0f2f4",
    "description": "次色混合实色软底"
  },
  {
    "schemaVersion": 1,
    "id": "color.border",
    "label": "边框",
    "category": "color",
    "defaultValue": "#dde1e6"
  },
  {
    "schemaVersion": 1,
    "id": "color.error",
    "label": "错误",
    "category": "color",
    "defaultValue": "#b44a42"
  },
  {
    "schemaVersion": 1,
    "id": "color.error-soft",
    "label": "错误软底",
    "category": "color",
    "defaultValue": "#f7ecea",
    "description": "错误色混合实色软底"
  },
  {
    "schemaVersion": 1,
    "id": "color.info",
    "label": "信息",
    "category": "color",
    "defaultValue": "#397bc1",
    "description": "信息色：比主色更冷、更灰，避免与品牌色撞车"
  },
  {
    "schemaVersion": 1,
    "id": "color.success",
    "label": "成功",
    "category": "color",
    "defaultValue": "#39715a"
  },
  {
    "schemaVersion": 1,
    "id": "color.success-soft",
    "label": "成功软底",
    "category": "color",
    "defaultValue": "#eaf2ee",
    "description": "成功色混合实色软底"
  },
  {
    "schemaVersion": 1,
    "id": "color.warning",
    "label": "警告",
    "category": "color",
    "defaultValue": "#87651c"
  },
  {
    "schemaVersion": 1,
    "id": "color.warning-soft",
    "label": "警告软底",
    "category": "color",
    "defaultValue": "#f5f0e4",
    "description": "警告色混合实色软底"
  },
  {
    "schemaVersion": 1,
    "id": "color.on-surface",
    "label": "表面上文字",
    "category": "color",
    "defaultValue": "#1d1f23"
  },
  {
    "schemaVersion": 1,
    "id": "color.on-surface-muted",
    "label": "表面弱化文字",
    "category": "color",
    "defaultValue": "#666b73",
    "description": "表面上文字约 62% 透明度，用于副标题与提示"
  },
  {
    "schemaVersion": 1,
    "id": "typography.title",
    "label": "标题",
    "category": "typography",
    "defaultValue": "650 20px/1.3 Inter, system-ui, sans-serif",
    "description": "fontWeight 650 · fontSize 20px"
  },
  {
    "schemaVersion": 1,
    "id": "typography.subtitle",
    "label": "副标题",
    "category": "typography",
    "defaultValue": "600 16px/1.4 Inter, system-ui, sans-serif",
    "description": "fontWeight 600 · fontSize 16px"
  },
  {
    "schemaVersion": 1,
    "id": "typography.content",
    "label": "正文",
    "category": "typography",
    "defaultValue": "400 14px/1.5 Inter, system-ui, sans-serif",
    "description": "fontWeight 400 · fontSize 14px"
  },
  {
    "schemaVersion": 1,
    "id": "typography.caption",
    "label": "辅助说明",
    "category": "typography",
    "defaultValue": "400 12px/1.4 Inter, system-ui, sans-serif",
    "description": "fontWeight 400 · fontSize 12px"
  },
  {
    "schemaVersion": 1,
    "id": "spacing.xs",
    "label": "超小间距",
    "category": "spacing",
    "defaultValue": 4
  },
  {
    "schemaVersion": 1,
    "id": "spacing.sm",
    "label": "小间距",
    "category": "spacing",
    "defaultValue": 8
  },
  {
    "schemaVersion": 1,
    "id": "spacing.md",
    "label": "中间距",
    "category": "spacing",
    "defaultValue": 16
  },
  {
    "schemaVersion": 1,
    "id": "spacing.lg",
    "label": "大间距",
    "category": "spacing",
    "defaultValue": 24
  },
  {
    "schemaVersion": 1,
    "id": "spacing.xl",
    "label": "超大间距",
    "category": "spacing",
    "defaultValue": 32
  },
  {
    "schemaVersion": 1,
    "id": "radius.none",
    "label": "无圆角",
    "category": "radius",
    "defaultValue": 0
  },
  {
    "schemaVersion": 1,
    "id": "radius.sm",
    "label": "小圆角",
    "category": "radius",
    "defaultValue": 8
  },
  {
    "schemaVersion": 1,
    "id": "radius.md",
    "label": "中圆角",
    "category": "radius",
    "defaultValue": 12
  },
  {
    "schemaVersion": 1,
    "id": "radius.lg",
    "label": "大圆角",
    "category": "radius",
    "defaultValue": 16
  },
  {
    "schemaVersion": 1,
    "id": "radius.full",
    "label": "全圆角",
    "category": "radius",
    "defaultValue": 999
  },
  {
    "schemaVersion": 1,
    "id": "elevation.none",
    "label": "无阴影",
    "category": "elevation",
    "defaultValue": "none"
  },
  {
    "schemaVersion": 1,
    "id": "elevation.card",
    "label": "卡片阴影",
    "category": "elevation",
    "defaultValue": "0 1px 2px rgba(15, 23, 42, 0.08), 0 8px 24px rgba(15, 23, 42, 0.06)"
  },
  {
    "schemaVersion": 1,
    "id": "elevation.raised",
    "label": "浮起阴影",
    "category": "elevation",
    "defaultValue": "0 4px 12px rgba(15, 23, 42, 0.12), 0 16px 32px rgba(15, 23, 42, 0.08)"
  },
  {
    "schemaVersion": 1,
    "id": "color.surface-variant",
    "label": "次级表面",
    "category": "color",
    "defaultValue": "#f0f2f4",
    "description": "弱分区、表格表头与次级容器"
  },
  {
    "schemaVersion": 1,
    "id": "color.surface-raised",
    "label": "浮层表面",
    "category": "color",
    "defaultValue": "#ffffff",
    "description": "菜单、Dialog 与悬浮工具栏"
  },
  {
    "schemaVersion": 1,
    "id": "color.on-background",
    "label": "背景上文字",
    "category": "color",
    "defaultValue": "#1d1f23"
  },
  {
    "schemaVersion": 1,
    "id": "color.on-secondary",
    "label": "次色上文字",
    "category": "color",
    "defaultValue": "#ffffff"
  },
  {
    "schemaVersion": 1,
    "id": "color.outline",
    "label": "轮廓",
    "category": "color",
    "defaultValue": "#aeb4bc"
  },
  {
    "schemaVersion": 1,
    "id": "color.divider",
    "label": "分割线",
    "category": "color",
    "defaultValue": "#e5e7ea"
  },
  {
    "schemaVersion": 1,
    "id": "color.disabled",
    "label": "禁用内容",
    "category": "color",
    "defaultValue": "#9aa0a8"
  },
  {
    "schemaVersion": 1,
    "id": "color.scrim",
    "label": "遮罩",
    "category": "color",
    "defaultValue": "#0f172a99"
  },
  {
    "schemaVersion": 1,
    "id": "color.on-error",
    "label": "错误色上文字",
    "category": "color",
    "defaultValue": "#ffffff"
  },
  {
    "schemaVersion": 1,
    "id": "color.on-success",
    "label": "成功色上文字",
    "category": "color",
    "defaultValue": "#ffffff"
  },
  {
    "schemaVersion": 1,
    "id": "color.on-warning",
    "label": "警告色上文字",
    "category": "color",
    "defaultValue": "#251a00"
  },
  {
    "schemaVersion": 1,
    "id": "color.on-info",
    "label": "信息色上文字",
    "category": "color",
    "defaultValue": "#ffffff"
  },

  {
    "schemaVersion": 1,
    "id": "typography.display",
    "label": "展示标题",
    "category": "typography",
    "defaultValue": "700 40px/1.15 Inter, system-ui, sans-serif"
  },
  {
    "schemaVersion": 1,
    "id": "typography.headline",
    "label": "页面标题",
    "category": "typography",
    "defaultValue": "700 28px/1.2 Inter, system-ui, sans-serif"
  },
  {
    "schemaVersion": 1,
    "id": "typography.title-sm",
    "label": "小标题",
    "category": "typography",
    "defaultValue": "650 18px/1.35 Inter, system-ui, sans-serif"
  },
  {
    "schemaVersion": 1,
    "id": "typography.title-lg",
    "label": "大标题",
    "category": "typography",
    "defaultValue": "700 24px/1.25 Inter, system-ui, sans-serif"
  },
  {
    "schemaVersion": 1,
    "id": "typography.body-sm",
    "label": "小正文",
    "category": "typography",
    "defaultValue": "400 13px/1.5 Inter, system-ui, sans-serif"
  },
  {
    "schemaVersion": 1,
    "id": "typography.body-lg",
    "label": "大正文",
    "category": "typography",
    "defaultValue": "400 16px/1.55 Inter, system-ui, sans-serif"
  },
  {
    "schemaVersion": 1,
    "id": "typography.label",
    "label": "控件标签",
    "category": "typography",
    "defaultValue": "600 14px/1.4 Inter, system-ui, sans-serif"
  },
  {
    "schemaVersion": 1,
    "id": "typography.caption-strong",
    "label": "强调说明",
    "category": "typography",
    "defaultValue": "600 12px/1.4 Inter, system-ui, sans-serif"
  },

  {
    "schemaVersion": 1,
    "id": "spacing.none",
    "label": "无间距",
    "category": "spacing",
    "defaultValue": 0
  },
  {
    "schemaVersion": 1,
    "id": "spacing.xxs",
    "label": "极小间距",
    "category": "spacing",
    "defaultValue": 2
  },
  {
    "schemaVersion": 1,
    "id": "spacing.sm-plus",
    "label": "中小间距",
    "category": "spacing",
    "defaultValue": 12
  },
  {
    "schemaVersion": 1,
    "id": "spacing.lg-plus",
    "label": "大间距",
    "category": "spacing",
    "defaultValue": 40
  },
  {
    "schemaVersion": 1,
    "id": "spacing.2xl",
    "label": "二倍大间距",
    "category": "spacing",
    "defaultValue": 48
  },
  {
    "schemaVersion": 1,
    "id": "spacing.3xl",
    "label": "三倍大间距",
    "category": "spacing",
    "defaultValue": 64
  },

  {
    "schemaVersion": 1,
    "id": "sizing.control-sm",